event_id,beginUTC,magnitude,magnitude_type,event_narrative,episode_narrative,location_1_lat,location_1_lon
250206,9/13/2010 22:25,66,MS,A spotter with an anemometer measured a thunderstorm wind gust of 76 mph a little west of Ashland.  The winds caused major damage to at least one roof in or near Ashland with numerous large tree limbs and a few trees downed from southwest of town into town.  The fallen trees damaged several houses and vehicles in the area.,"Thunderstorms developed by mid afternoon on Sept. 13 along and north of a warm front that had moved into east central Nebraska.  The air mass south of the boundary was moderately unstable with temperatures in the mid to upper 80s and dew point temperatures around 70.  Additional thunderstorms developed in this unstable air mass south of the front, several of which were supercells.  One supercell, the right-mover of a storm that split in Jefferson county produced a brief tornado southwest of Fairbury.  Meanwhile, another supercell produced a swath of wind damage as it tracked south-southeast from around Wahoo into the southeast corner of Nebraska.  Especially hard hit from that particular storm was the area from southeast Saunders county into Cass and Otoe counties where winds were estimated by an assessment team from the NWS at 60 to 80 mph.  Several semi-trucks were blown off of Interstate 80 in this area and almost 3,000 customers lost power due to significant damage to trees, power poles/lines, houses and other structures in that region.  The Nebraska Emergency Management Agency estimated that preliminary estimates of damage to public infrastructure totaled more than $2.7 million from the storms and 7 counties applied for federal disaster aid.",41.0279,-96.4509
223352,6/4/2010 6:16,50,MG,nan,"A line of thunderstorms crossed the Tanana area late on the evening of the 3rd.  A wind gust to 58 mph was observed at the Tanana ASOS at 2116AKST.  The high winds associated with the thunderstorm produced wind damage.  A total of 22 trees, some with a trunk diameter over 2 feet were blown over.  One residential powerline fell, with associated cable TV lines.  A roof was blown off of a shed as well as a small smokehouse.  Numerous boats along the Yukon River were blown up on the shore, and some of them had minor damage.",65.18,-152.12
247732,6/23/2010 19:18,38,MG,The buoy SJNP4 in the San Juan harbor recorded a 38 knots or 44 mph wind gust. Broadcast media reported a tree downed on a vehicle on Baldorioty Ave at 301 pm. Another gust that reached 31 knots or 36 mph was recorded by this same buoy at 330 pm.,A strong tropical wave that was located near the Windward Passage helped to  spread showers across Puerto Rico while a second tropical wave was moving south of the island.,18.4589,-66.1164
248193,7/1/2010 21:07,40,MG,The Cape Air observer on duty at the Mayaguez Eugenio Maria de Hostos airport indicated he had measured winds of around 44 mph.,"During the late afternoon of Thursday, July 1, 2010, the National Weather Service Forecast Office received reports of very strong winds that were observed at the Mayagüez airport. These strong winds caused considerable damage to approximately nine portable tents that had been installed at the airport, as part of the medical support for the Mayagüez 2010 Central American Games. The Cape Air observer on duty called the National Weather Service (NWS) Office, indicating that he had measured winds of around 40 knots (44 mph), and a sudden gust of 72 knots (80 mph), but that no funnel cloud, tornado, or hail was observed at the time. Based on a visual NWS survey, the area that suffered the most significant damage was located at the airport and its vicinity with the following damage noted:The tents were blown off and pushed against the airport fence, causing damage to the fence. A metal railing attached to the ground and to a walk concrete way was lifted. One airport customer facility sliding doors were taken off their tracks. An aircraft that was not tied down and whose tail was unlocked, was turned sideways under the wind gusts. Many trees around the airport had snapped branches, indicative of a wind gust of 50 to 60 mph. Given the reports from the field, this wind event could be classified as a wet mini-microburst. The damage surveyed was indicative of straight line winds, and limited to the general airport area.",18.2541,-67.151
250240,7/17/2010 17:14,42,MG,The Cabo Rojo RAWS station at the National Wildlife Refuge recorded a sustained wind of 29 mph with a gust to 48 mph from the east southeast at 1:14 pm and 1:43 pm. Several wind gusts between 42-45 mph were recorded between 2:34-3:43 pm. A downed tree was reported by emergency along road 308 in Cabo Rojo.,"During the early afternoon of Saturday July 17, a squall line affected the grounds of the Olympic Stadium in the City of Mayaguez, where the Opening Ceremony for the the Mayaguez 2010 Central American Games was to be held later during the afternoon. The squall line reached the city of Mayaguez,  producing strong gusty winds that  downed a scaffold equipped with lighting equipment at the Isidoro Garcia Park, near the Mayaguez coast. Several persons were injured and some vehicles were damaged as the platform fell to the ground. Downed trees and power lines were reported in several municipalities of western Puerto Rico. Officials were forced to delay the Opening Ceremony.The NOS-NWLON sensor at the Penuelas-Guayanilla Bay reported a wind gust to 53 mph at 12:17 pm as the squall line moved through. The Cabo Rojo National Wildlife Refuge sensor recorded at wind gust to 48 mph at 1:14 pm. Data from the Puerto Rico Electric Power Company (PREPA) wind sensor at El Mani site near the Mayaguez airport, indicated wind gusts of around 33 mph at 1230 pm, 36 mph at 1245 pm, and 30 mph at 1:00 pm. The PREPA net highest wind gust was recorded at La Parguera sensor in Lajas where a 46 mph gust was recorded around 12 noon. Other locations in Puerto Rico recorded wind gusts that varied from 35-45 mph. Initial local and national media reports attributed this wind event to a tornado or a waterspout that had moved inland. However, most of the evidence indicates that it was an outflow boundary that propagated from the east southeast to the west northwest.",17.9715,-67.1684
253210,7/17/2010 16:17,46,MG,"The Penuelas Guayanilla NOS NWLON weather sensor recorded sustained winds of 41 mph with gusts to 53 mph from the south at 12:17 PM, as a squall line moved west northwest. Sustained winds from 33-38 mph with gusts between 38-47 mph were recorded between 12:27 -13:08 AST from the south and south southeast.","During the early afternoon of Saturday July 17, a squall line affected the grounds of the Olympic Stadium in the City of Mayaguez, where the Opening Ceremony for the the Mayaguez 2010 Central American Games was to be held later during the afternoon. The squall line reached the city of Mayaguez,  producing strong gusty winds that  downed a scaffold equipped with lighting equipment at the Isidoro Garcia Park, near the Mayaguez coast. Several persons were injured and some vehicles were damaged as the platform fell to the ground. Downed trees and power lines were reported in several municipalities of western Puerto Rico. Officials were forced to delay the Opening Ceremony.The NOS-NWLON sensor at the Penuelas-Guayanilla Bay reported a wind gust to 53 mph at 12:17 pm as the squall line moved through. The Cabo Rojo National Wildlife Refuge sensor recorded at wind gust to 48 mph at 1:14 pm. Data from the Puerto Rico Electric Power Company (PREPA) wind sensor at El Mani site near the Mayaguez airport, indicated wind gusts of around 33 mph at 1230 pm, 36 mph at 1245 pm, and 30 mph at 1:00 pm. The PREPA net highest wind gust was recorded at La Parguera sensor in Lajas where a 46 mph gust was recorded around 12 noon. Other locations in Puerto Rico recorded wind gusts that varied from 35-45 mph. Initial local and national media reports attributed this wind event to a tornado or a waterspout that had moved inland. However, most of the evidence indicates that it was an outflow boundary that propagated from the east southeast to the west northwest.",17.9721,-66.7617
249803,8/13/2010 9:30,42,MG,"Despite only measuring a 48 mph gust, several 9 inch diameter trees were blown down, one of which blocked County Road 77.  Also, some roofing material was blown off a house.","A very strong line of thunderstorms moved through southeast Minnesota during the early morning hours of August 13th.  Strong winds blew down trees and some significant structural damage, while widespread heavy rain amounts of 3 to 4 inches caused some flash flooding, road closures, and rises along rivers, streams and creeks.",44.4,-92.1003
226163,6/18/2010 1:00,48,MG,nan,Heat and humidity combined to touch off isolated severe storms on the afternoon and evening of the 17th and again on the 20th.,34.6,-91.57
220090,5/1/2010 4:35,50,MG,A wind gust of 58 mph was measured at a television station in Cape Girardeau. Trees were down in the Jackson and Gordonville areas.,Thunderstorms developed ahead of an eastward moving cold front over the Ozarks. Strengthening mid-level winds ahead of a strong shortwave trough over the central Plains aided storm development. Moderate instability combined with strong effective bulk shear around 50 knots provided very favorable conditions for supercells as the storms spread northeastward.,37.3,-89.53
232430,7/4/2010 1:32,50,MG,nan,"A cluster of severe thunderstorms moved northeastward from western Nebraska across south central South Dakota. Large hail and strong winds accompanied the storms over southeastern Bennett, Todd, and Tripp Counties. Trees were downed throughout the area; with some damage to homes, buildings, and personal property.",43.3905,-99.8418
250231,9/14/2010 0:35,50,MG,Thunderstorm wind gusts were measured at 58 mph by Asos at the Falls City airport at 743pm CDT.  Winds were estimated at close to 65 mph in town which downed numerous tree limbs.   Pea-size hail and over 3 inches of rain in an hour was also reported.  The storm total in the Fall City area this evening was over 3 inches.,"Thunderstorms developed by mid afternoon on Sept. 13 along and north of a warm front that had moved into east central Nebraska.  The air mass south of the boundary was moderately unstable with temperatures in the mid to upper 80s and dew point temperatures around 70.  Additional thunderstorms developed in this unstable air mass south of the front, several of which were supercells.  One supercell, the right-mover of a storm that split in Jefferson county produced a brief tornado southwest of Fairbury.  Meanwhile, another supercell produced a swath of wind damage as it tracked south-southeast from around Wahoo into the southeast corner of Nebraska.  Especially hard hit from that particular storm was the area from southeast Saunders county into Cass and Otoe counties where winds were estimated by an assessment team from the NWS at 60 to 80 mph.  Several semi-trucks were blown off of Interstate 80 in this area and almost 3,000 customers lost power due to significant damage to trees, power poles/lines, houses and other structures in that region.  The Nebraska Emergency Management Agency estimated that preliminary estimates of damage to public infrastructure totaled more than $2.7 million from the storms and 7 counties applied for federal disaster aid.",40.0777,-95.5908
232350,5/25/2010 20:35,50,MG,Winds gusted to 50 knots for 7 minutes at Rockford Airport.,Strong to severe thunderstorms moved across parts of northern Illinois during the afternoon hours of May 25th producing strong winds and heavy rain.,42.2,-89.1
244944,7/2/2010 7:09,50,MG,nan,"In the late evening hours of Thursday, July 1st, Severe Thunderstorm Watch number 437 was issued for western North Dakota, in anticipation of a bowing multicellular thunderstorm moving eastward over eastern Montana, towards western North Dakota and towards an increasingly moist and unstable environment. Over time, the northern section of the thunderstorm sustained its strength while the southern half dissipated. The storm moved across northwest North Dakota during the early morning hours of Friday, July 2nd, and prompted several severe thunderstorm warnings. Several reports of severe thunderstorm wind gusts were received.",48.91,-103.29
249718,7/20/2010 12:15,50,MG,Thunderstorm winds blew down some power lines on the north side of town and an agricultural weather station southeast of town measured a 58 MPH wind gust.,Several rounds of storms moved through the region during the period of July 18th through July 21st.  There were numerous reports of flash flooding and wind damage as well as some isolated reports of large hail.,38.979,-92.33
231799,6/1/2010 0:45,50,MG,"Broadcast and print media relayed reports of minor damage from thunderstorm winds in Plainview shortly before 19:00 CST.  Damaging thunderstorm winds downed a number of large tree limbs and utility lines in the city. More than 2,000 residents lost electrical power at 18:45 CST, and electrical power was out for approximately two hours.  A Texas Tech University West Texas Mesonet site just south of Plainview recorded a 58 mph wind gust at 18:50 CST.  No injuries or structural damage was reported.","Scattered thunderstorms developed over the extreme southwestern Texas Panhandle and the northwestern South Plains during the late afternoon and early evening of the 31st.  A small linear complex emerged from the convection, and resulted in damaging winds as it moved eastward over portions of Lamb and Hale Counties. The most significant impacts occurred in Plainview (Hale County), where downed utility lines left upwards of 2,000 customers without electrical power for approximately two hours.",34.2,-101.7
238417,6/17/2010 4:47,50,MG,Recorded at the Long Lake National Wildlife Refuge Remote Automated Weather Station.,"A large upper level trough moving into the northern Rockies resulted in surface cyclogenisis over eastern Montana. Tornado Watch numbers 326 and 329 were issued in the late afternoon and early evening (respectively) for much of west and central North Dakota Wednesday, June 16th, with possible tornadic thunderstorms developing near a surface warm front lifting north across the Dakotas. Several warnings were issued during the evening across western North Dakota, but no reports were received. Later in the evening, Severe Thunderstorm Watch 331 was issued for south central North Dakota as a small cluster of intense and long-lived thunderstorms over north central South Dakota continued to advect north.   A damaging thunderstorm wind event evolved across south central North Dakota late in the evening of June 16th and into the early morning hours of Thursday, June 17th. Thunderstorms moving across Burleigh, Emmons and Sheridan Counties were able to mix strong mid level winds associated with a nocturnal low level jet to the surface. Numerous reports of strong thunderstorm winds and associated damage were received.",46.68,-100.1745
254678,8/12/2010 5:16,50,MG,"This was the second of two rounds of wind to strike the city of Minot. The first round was associated with a gust front, and this second gust was associated with heavy precipitation.","A mid level trough ejecting northeast through the Northern Rockies, combined with a stalled frontal boundary, resulted in strong to severe thunderstorm development across central Montana in the late afternoon. These storms continued to move and develop eastward into western and portions of central North Dakota during the evening hours of Wednesday, August 11th and into the early morning of Thursday, August 12th.   Multiple severe thunderstorm warnings were issued. Several reports of large hail and multiple reports of severe thunderstorm wind gusts were received during this episode.",48.23,-101.3
258367,8/20/2010 20:45,50,MG,County sheriff deputies reported trees and power lines were blown down by the strong thunderstorm gusts. The AWOS at Janesville airport recorded a 58 mph (50 knot) wind gust at 345 pm CDT.,"A short wave moving up the leading flank of an elongated large-scale trough that extended from the Upper Mississippi River Valley to the Central Plains provided large-scale lift for thunderstorm development over southern Wisconsin. A warm front extended across central Wisconsin back to surface low pressure over west-central Minnesota. This placed southern Wisconsin in a warm humid air mass, with temperatures in the 80s and dew points in the lower 70s producing CAPE values reaching 2000 J/kg. Deep-layer shear profiles were favorable for supercells as well as multicell line segments that produced damaging wind gusts. The thunderstorm winds caused widespread tree and power line damage. WE energies reported 23,000 customers were without power.",42.6595,-89.0478
264283,10/26/2010 10:55,50,MG,"Thunderstorm winds blew down numerous trees, tree limbs and power lines.","A very strong cold front moved through the area, triggering a line of strong to severe thunderstorms.  Widespread damaging wind reports were received with these storms.",38.5169,-89.093
242273,6/13/2010 21:35,50,MG,nan,Severe thunderstorms across the eastern Oklahoma Panhandle during the mid and late afternoon hours produced large hail...strong winds and a few tornadoes. No damage or injuries were reported.,36.6,-100.26
234240,7/18/2010 1:26,50,MG,"The Crystal Airport measured a 50 knot wind gust.  In addition, several large tree limbs were blown down around Brooklyn Center, Minnesota.","The atmosphere became very unstable Saturday afternoon, and along with a strong wind shear, aided in the development of very large hail, isolated tornadoes and significant straight-line wind damage.   The first storm developed near Alexandria and moved southeast along Interstate 94 before dying in the southwest part of the Twin Cities late that afternoon. Numerous reports of very large hail, up to the size of softballs, occurred near St. Cloud, southeast to Watertown.    The next area of severe storms developed across central Minnesota, and far west-central Minnesota and moved east and southeast toward east-central Minnesota where a strong bow echo developed and moved across the northern portion of the Twin Cities Metropolitan Area.   There was widespread damage along the leading edge of this bow echo where numerous trees, power lines and homes were either uprooted, blown down, or destroyed.   These storms moved into west-central Wisconsin and also caused damage to trees before weakening toward the late evening.",45.0607,-93.3553
222885,4/8/2010 3:30,50,MG,Winds were measured at 58 mph just west of Parsons.,"A cold front moved through the Mid-South during the afternoon and evening hours of April 7th, 2010. Showers and thunderstorms developed out ahead of the front. Some storms became severe producing large hail, damaging winds, and flash flooding.",35.6427,-88.1644
234889,6/10/2010 23:25,50,MG,nan,Severe thunderstorms produced hail and strong thunderstorm wind gusts across the central and southern Texas Panhandle during the early evening hours. Although no injuries were reported...some damage occurred in the central Texas Panhandle.,35.96,-100.97
249240,7/5/2010 4:30,50,MG,nan,Severe thunderstorms moved across the central Oklahoma Panhandle during the late evening hours producing strong wind gusts. No damage or injuries were reported.,36.6,-101.6
254915,8/5/2010 0:22,50,MG,nan,Severe thunderstorms produced some hail along with damaging thunderstorm winds during the early evening hours across the western...southern...central and eastern Texas Panhandle. No injuries were reported...however there were several reports of damage from the hail and thunderstorm winds.,35.6136,-100.9965
261839,9/13/2010 19:55,50,MG,nan,"Severe thunderstorms developed during the afternoon and early evening hours across the central and southeastern Texas Panhandle. These storms produced strong thunderstorm wind gusts which blew down a couple of large trees north of Panhandle Texas in Carson County. Otherwise, no damages or injuries were reported.",34.92,-100.93
234871,6/16/2010 23:50,50,MG,nan,A tight pressure gradient across the central Oklahoma Panhandle during the early morning hours caused strong non-thunderstorm wind gusts. Severe thunderstorms during the evening hours produced strong thunderstorm wind gusts which resulted in damage across the western and central Oklahoma Panhandle. No injuries were reported.  At 0500 CST...The Oklahoma Mesonet station located one mile west of Hooker Oklahoma measured a non-thunderstorm wind gust of fifty-three knots.,36.83,-102.88
241840,6/25/2010 23:58,50,MG,"A 50 knot wind gust was measured at the New Ulm, Airport.","During the morning of Friday June 25th, a small complex of thunderstorms developed across west-central Minnesota, and quickly moved eastward across southern Minnesota. Isolated severe weather occurred with these storms in west-central Minnesota during the morning hours.   During the afternoon, a larger complex of storms developed across western Minnesota, and moved quickly across portions of central and southern Minnesota during the evening. Damage was extensive as several bow echoes, supercells, and squall lines raced across the area.  There were numerous reports of structural damage to farms and homesteads, very large hail, and very large trees blown down.  Softball to baseball size hail was reported near New Ulm, Minnesota, with several reports of wind damage throughout southern, and east-central Minnesota.    Several significant tornadoes occurred in portions of south central Minnesota during the late afternoon, and early evening hours.    Two separate severe storms moved across the Twin Cities area, one produced minor damage with hail in the late afternoon, but the second that occurred in the early evening caused more straight-line wind damage throughout the area, along with flash flooding.",44.31,-94.46
236880,6/26/2010 0:58,50,MG,A measured wind gust at the New Ulm Airport.,"During the morning of Friday June 25th, a small complex of thunderstorms developed across west-central Minnesota, and quickly moved eastward across southern Minnesota. Isolated severe weather occurred with these storms in west-central Minnesota during the morning hours.   During the afternoon, a larger complex of storms developed across western Minnesota, and moved quickly across portions of central and southern Minnesota during the evening. Damage was extensive as several bow echoes, supercells, and squall lines raced across the area.  There were numerous reports of structural damage to farms and homesteads, very large hail, and very large trees blown down.  Softball to baseball size hail was reported near New Ulm, Minnesota, with several reports of wind damage throughout southern, and east-central Minnesota.    Several significant tornadoes occurred in portions of south central Minnesota during the late afternoon, and early evening hours.    Two separate severe storms moved across the Twin Cities area, one produced minor damage with hail in the late afternoon, but the second that occurred in the early evening caused more straight-line wind damage throughout the area, along with flash flooding.",44.31,-94.46
255755,9/2/2010 23:34,50,MG,nan,"A line of thunderstorms developed ahead of a strong cold front and very quickly became severe with very strong winds and marginally severe hail. Wind gusts in excess of 70 mph were reported over the northwest portion of Oklahoma City, causing quite a bit of damage. The squall line continued toward the Red River, and then moving into northern Texas by mid evening.",35.53,-97.65
215617,4/2/2010 12:25,50,MG,nan,"A pacific cold front/dry line moved east through Oklahoma during the late morning hours of the 1st into the morning of the 2nd. Showers and thunderstorms developed along the front, with the aide of an upper level storm system that slowly moved east toward the southern plains. The thunderstorms increased in intensity as they moved/developed east, as better instability was in place. Strong wind shear was also in place, as the nocturnal low-level jet developed. Although hail up to golf-ball size was reported with a few of the thunderstorms as they moved east and northeast, the severe winds were the main threats with storms. Some of the storms caused extensive damage, especially in the Rush Springs area, as they moved northeast from southern into central Oklahoma. Most severe wind gusts were between 60 and 70 mph, but in and around the Rush Springs area, gusts were more likely between 90 and 100 mph. Additional damage occurred further northeast into central Oklahoma. Damage was reported in and around Newcastle, Blanchard, Norman, and Oklahoma City. And most of this occurred as the morning rush was developing. At least 3,000 people were without power across central Oklahoma. The storms continued into eastern Oklahoma by late morning.",35.6501,-96.7996
