event_id,beginUTC,magnitude,magnitude_type,event_narrative,episode_narrative,location_1_lat,location_1_lon
235386,6/24/2010 1:11,52,MG,nan,"A line of severe storms advanced from Illinois and intensified further as it interacted with strong instability and shear. The line took on a line echo wave pattern (LEWP), resulting in an abundance of wind damage reports, including a large scale microburst in La Porte county. In addition, several small, but strong areas of rotation developed on the north side of the LEWP, resulting in several tornadoes across Elkhart and Kosciusko counties.",41.07,-86.22
231106,6/24/2010 3:41,52,MG,nan,Severe weather developed during the late evening hours across the area.  The main threat was damaging thunderstorm winds.,40.43,-84.03
253852,7/24/2010 0:23,52,MG,Emergency management officials recorded winds of 60 mph southeast of Bronson.,A hot and moist air mass was in place across southern Lower Michigan with temperatures in the 90s and dewpoints in the 70s. Strong wind fields in the lower levels were able to reach the ground in several locations causing damage.,41.86,-85.18
245161,8/4/2010 18:00,52,MG,nan,"A very unstable air mass was in place with temperatures in the 90s and dew points in the upper 70s.  While forcing was weak, there was enough lift ahead of a mid-level impulse to spark widespread convection in the form of a mesoscale convective system.",40.4,-82.95
245160,8/4/2010 18:03,52,MG,nan,"A very unstable air mass was in place with temperatures in the 90s and dew points in the upper 70s.  While forcing was weak, there was enough lift ahead of a mid-level impulse to spark widespread convection in the form of a mesoscale convective system.",40.33,-82.95
256259,9/22/2010 21:30,52,MG,nan,A weak frontal boundary pushed south into the region with modest instability and shear. The storms were generally poorly organized but managed to produce some pockets of strong to severe wind.  One brief tornado touchdown also occurred with the storms.,40.1279,-82.52
259008,10/26/2010 16:17,52,MG,The wind gust was measured from a volunteer fire departments weather station.,"A historically deep low pressure system sent a very strong cold front into a marginally unstable, but very sheared environment.  A line of storms formed west of the area overnight and moved into the region during the peak heating hours of the day.  Severe wind gusts occurred along the entire line with multiple tornadoes occurring around the region as well.",38.62,-84.9
209427,2/24/2010 17:35,52,MG,A mesonet site recorded a wind gust to 60 mph as the severe thunderstorms passed by.,Scattered thunderstorms developed over south Florida along and north of a lifting warm-front. Several of the storms acquired supercell characteristics as they moved northeast into Martin and St. Lucie Counties. Several reports of wind damage and hail were received. Two individuals were injured by the large hail.,27.21,-80.35
224452,4/16/2010 19:40,52,MG,A wind gust of 60 mph was measured at a radio station near Conococheague.,A cold front passed through Maryland on the 16th. There was just enough instability ahead of the front for a couple severe thunderstorms that produced strong winds.,39.6481,-77.857
216073,4/16/2010 20:40,52,MG,Thunderstorm winds measured 60 mph.,"Severe thunderstorms crossed the Commonwealth during the mid afternoon and early evening hours, producing multiple reports of straight line damaging winds. The primary damage area started in Clearfield County along Interstate 80 and extended east-southeast through the south central mountains and into the lower Susquehanna Valley. Thunderstorm structures organized into bowing line segments, which tapped and accentuated anomalously strong environmental winds in the middle to lower atmosphere. Numerous measured peak wind gusts between 50 and 80 mph were reported via ASOS. One injury occurred in Cumberland County (Monroe Township) when a tree fell onto a vehicle.",40.33,-78.92
227746,4/25/2010 0:52,52,MG,A 52 knot gust was measured at the LEX ASOS.,"A severe squall line developed in advance of an occluded front moving across central Kentucky.  This squall line produced widespread wind damage across south central Kentucky and into the Bluegrass region.  In addition, two brief tornadoes touched down in Mercer and Edmonson counties.",38.04,-84.46
227013,5/4/2010 17:10,52,MG,A measured wind gust of 60 mph was reported in Ilion.,"A frontal boundary and strong upper level disturbance approached and crossed the region on Tuesday, May 4th, triggering thunderstorms.",43.01,-75.04
236576,5/8/2010 2:08,52,MG,nan,"Showers and thunderstorms moved across the eastern end of Lake Erie and onshore across parts of Western New York. The thunderstorms produced winds gusting to 60 mph which downed trees and power lines. Damage was reported in Silver Creek, Otto and Youngstown.",42.54,-79.17
236577,5/8/2010 3:00,52,MG,nan,"Showers and thunderstorms moved across the eastern end of Lake Erie and onshore across parts of Western New York. The thunderstorms produced winds gusting to 60 mph which downed trees and power lines. Damage was reported in Silver Creek, Otto and Youngstown.",42.41,-78.79
232923,5/12/2010 23:06,52,MG,Wind gust of 60 mph was measured at Cape Henry.,Scattered severe thunderstorms in advance of a cold front produced damaging winds and large hail across portions of central and eastern Virginia.,36.93,-76.01
229816,5/14/2010 22:33,52,MG,A wind gust of 60 mph was measured about one mile north-northwest of Elk Garden.,"High pressure over the western Atlantic pumped in plenty of warm and humid air on the 14th. An upper-level disturbance passed through the region during the afternoon and evening hours, bringing showers and thunderstorms. Moderate to high amounts of instability was present due to relatively colder air aloft and warm, moist air at the surface. This caused thunderstorms to become severe with large hail being the primary threat.",39.3911,-79.1584
222157,5/16/2010 19:15,52,MG,A 52 knot wind gust was measured one half mile west of Springdale.,Convection developed during the afternoon with continuation into the evening hours near a stationary frontal boundary. Severe weather affected Southwest Virginia and East Tennessee and was composed entirely of damaging wind gusts.,36.42,-83.53
220459,5/17/2010 18:31,52,MG,"A peak wind gust of 60 mph was recorded at Patrick Air Force Base as a strong thunderstorm briefly and locally became severe before moving offshore. Along Highway A1A just east of the airbase, several hanging traffic signals were damaged.",A strong thunderstorm moved to the coast from the central Florida interior and briefly and locally reached severe levels as it interacted with a sea breeze boundary along the Brevard County coast. A wind gust to 60 mph was recorded by weather observers at Patrick Air Force Base.,28.23,-80.598
229738,5/31/2010 17:48,52,MG,An automated sensor at the Ashtabula County Airport measured a 60 mph thunderstorm wind gust.,A warm front lifted north across northern Ohio during the afternoon hours of May 31st.  A cold front followed during the evening.  Showers and thunderstorms developed in association with both of these fronts.   Slow moving thunderstorms produced heavy rainfall which caused flash flooding in a few areas.  Rainfall rates at times were between two and three inches per hour.  A few locations received more than four inches of rainfall.  The flooding was the worst in western Geauga County were the damage was extensive.  A few storms also became severe with minor damage reported.,41.78,-80.7
230108,6/2/2010 23:57,52,MG,nan,The atmosphere eventually recovered from the passage of an outflow boundary in the morning.  Storms developed along a convergent axis ahead of a surface trough.  Lift was aided by an enhanced short wave moving across Indiana.,40,-82.88
230638,6/6/2010 12:28,52,MG,A trained spotter reported a measured wind gust of 60 MPH.,"Isolated severe thunderstorms developed in western Pennsylvania ahead of a strong cold front moving east across the upper Ohio valley. One of these storms produced a EF0  tornado in Mercer county, Pennsylvania.",41.31,-79.36
241710,6/13/2010 23:21,52,MG,"A wind gust, measured at 60 mph, was observed in north Danville.","With a stationary boundary draped across the region from west to east, a line of thunderstorms pushed eastward into west-central Indiana from Illinois during the evening of June 13th. This bowing line of storms turned southeast as it entered the forecast area. Numerous thunderstorm wind gusts and damage reports were received as this line of storms passed through the area.",39.7632,-86.5227
246841,6/14/2010 19:10,52,MG,A 60 mph thunderstorm wind gust was measured at the Shelbyville Airport.,A line of severe storms moved across Central Indiana on the afternoon and evening of June 14th bringing damaging thunderstorm winds and heavy rain to the region. The line of storms produced winds near 75 mph in some locations. A couple isolated storms formed across West-Central Indiana in the afternoon before the line pushed into Central Indiana.,39.5776,-85.8053
246821,6/14/2010 23:55,52,MG,A thunderstorm wind gust measured at 60 mph was observed in this location.,A line of severe storms moved across Central Indiana on the afternoon and evening of June 14th bringing damaging thunderstorm winds and heavy rain to the region. The line of storms produced winds near 75 mph in some locations. A couple isolated storms formed across West-Central Indiana in the afternoon before the line pushed into Central Indiana.,40.02,-86.47
246184,6/15/2010 23:52,52,MG,A 60 mph thunderstorm wind gust was measured in this location.,"A band of showers and embedded leading-edge thunderstorms moved into Central Indiana from Illinois during the afternoon and evening of the 15th of June. This line of severe storms moved across the forecast area bringing large hail, damaging winds and flash flooding reports from a number of counties.",39.52,-85.78
246186,6/16/2010 0:10,52,MG,A 60 mph thunderstorm wind gust was measured in Ingalls.,"A band of showers and embedded leading-edge thunderstorms moved into Central Indiana from Illinois during the afternoon and evening of the 15th of June. This line of severe storms moved across the forecast area bringing large hail, damaging winds and flash flooding reports from a number of counties.",39.9603,-85.7991
227688,6/16/2010 20:42,52,MG,The AWOS at Naval Air Station Jacksonville measured a wind gust of 60 mph.,A surface front was over north Florida as a mid and upper level ridge center was south of the region. A short wave trough traversed the area in the afternoon and combined with the sea breezes and outflows over an unstable air mass scattered severe storms developed across northeast Florida in the afternoon and evening.,30.2359,-81.6672
227787,6/17/2010 2:12,52,MG,nan,A line of heavy showers associated with a cold front moved over the Capital City Airport and produced a localized 60 mph wind gust. The gust was measured by the ASOS. No damage was reported.,40.2165,-76.8513
244117,6/19/2010 1:53,52,MG,A trained spotter reported a 60 mph thunderstorm wind gust.,"A long lived line of severe thunderstorms tracked east, impacting areas generally along and south of M-59.",42.27,-83.27
238477,6/22/2010 4:12,52,MG,Penny size hail accompanied these thunderstorm winds.,"Reports of heavy rainfall, funnel clouds, damaging winds, and hail were received from about 5:30 PM EST on June 21st to 2:30 AM EST June 22nd.  Portions of central Indiana received up to 4 inches of rain during the night of the 21st.  Because this area had already received nearly 2 inches of rain in the previous 72 hours, serious flash flooding occurred in portions of Clinton and Hendricks Counties.  Nearly the entire town of Edna Mills in northeast Clinton County and State Road 26 flooded.  In Hendricks County, two small dams located in the White Lick Creek drainage area were compromised.....Jeto Lake and Indian Head Lake dams were breached around 8:15 AM EST on the 22nd.  This caused the evacuation of a nearby mobile home park located along White Lick Creek just downstream of the dams.  County and state roads near the creek were flooded in the Avon, Plainfield and Mooresville areas.  High water affected the Crystal Bay area near Hummel Park in Plainfield.",39.66,-86.08
239496,6/23/2010 1:19,52,MG,Pine Oak limbs were snapped near California.,The subtropical ridge was to our south while the subtropical jet remained just to our north. An upper-level disturbance in the jet stream passed through on the 22nd. Warm and humid air was in place due to a west-southwest flow around the ridge. Moderate amounts of instability along with the upper-level disturbance caused showers and thunderstorms to develop. Some thunderstorms became severe with damaging winds and large hail.,38.2973,-76.4826
231473,6/23/2010 18:57,52,MG,An automated sensor at the Lorain County Airport measured a 62 mph thunderstorm wind gust.,A stationary front lingered over the Upper Ohio Valley on June 23rd and 24th.  Showers and thunderstorms developed along the front during the afternoon.  Several of the thunderstorms became severe.,41.35,-82.18
242160,6/24/2010 23:20,52,MG,A wind gust of 60 mph was reported at Patuxent River.,A cold front passed through the region on the 24th. Warm and humid air ahead of the cold front caused plenty of instability. The instability combined with the forcing from the front to trigger showers and thunderstorms. A few thunderstorms did produce damaging winds.,38.2901,-76.3981
231729,6/27/2010 21:38,52,MG,A thunderstorm wind gust was measured at 60 mph.,An area of low pressure moved east across the Great Lakes region during the afternoon and evening hours of June 27th.  A warm front stretching southeast from the low moved across northern Ohio during the afternoon and evening hours.  Showers and thunderstorms developed along the front with a few of the stronger storms becoming severe.  Very strong winds were associated with many of the thunderstorms.  A 78 mph wind gust was measured in Findlay. A tornado hit Ashtabula County during the evening hours causing some minor damage.,40.58,-83.13
242364,6/29/2010 0:25,52,MG,nan,"A cold front crossed the north country during the evening hours. Thunderstorms accompanying the front produced wind gusts to 60 mph across parts of Jefferson County. In Limerick, spotters reported trees downed by the thunderstorm winds.",44.03,-76.04
253291,7/23/2010 22:20,52,MG,A trained spotter measured a 60 mph thunderstorm wind gust.,"A tropical airmass and a frontal boundary lifted into southeast Michigan, which produced severe storms south of Eight Mile Road.",42.16,-83.7
253537,7/25/2010 19:33,52,MG,nan,"A strong cold front tracking through the region produced severe thunderstorms across the region, including a tornado in the Bronx.",40.73,-73.45
253554,7/25/2010 19:33,52,MG,nan,"A strong cold front tracking through the region produced severe thunderstorms across the region, including a tornado in the Bronx.",40.73,-73.41
250972,7/25/2010 19:49,52,MG,A wind gust of 60 mph was reported near Glenn Dale.,"A strong upper-level disturbance and its associated cold front moved into Maryland on the 25th. Hot and humid conditions ahead of the front led to high amounts of instability. Showers and thunderstorms developed along and ahead of the cold front. Due to the high amounts of instability, thunderstorms were able to mix down strong winds from aloft causing significant amounts of damage across portions of Maryland.",39.02,-76.76
250979,7/25/2010 20:04,52,MG,A wind gust of 60 mph was recorded near Eastport.,"A strong upper-level disturbance and its associated cold front moved into Maryland on the 25th. Hot and humid conditions ahead of the front led to high amounts of instability. Showers and thunderstorms developed along and ahead of the cold front. Due to the high amounts of instability, thunderstorms were able to mix down strong winds from aloft causing significant amounts of damage across portions of Maryland.",38.98,-76.49
255023,8/5/2010 19:14,52,MG,A wind gust of 60 mph was reported in Sudley.,A hot and humid air mass remained over Virginia on the 5th. A series of upper-level disturbances in a zonal flow passed through the Mid-Atlantic during this time. Showers and thunderstorms developed during the afternoon and evening hours. There was enough instability from the hot and humid air mass for some thunderstorms to contain damaging winds and large hail.,38.79,-77.49
255030,8/5/2010 19:40,52,MG,A wind gust of 60 mph was measured at the intersection of 395 and Quaker Lane.,A hot and humid air mass remained over Virginia on the 5th. A series of upper-level disturbances in a zonal flow passed through the Mid-Atlantic during this time. Showers and thunderstorms developed during the afternoon and evening hours. There was enough instability from the hot and humid air mass for some thunderstorms to contain damaging winds and large hail.,38.8403,-77.0853
260249,9/22/2010 2:59,52,MG,nan,A cold front swept through Southeast Michigan producing several severe thunderstorms north of M-59.,42.97,-83.76
260250,9/22/2010 2:59,52,MG,nan,A cold front swept through Southeast Michigan producing several severe thunderstorms north of M-59.,42.97,-83.76
253001,9/22/2010 20:29,52,MG,The Williamsport Regional Airport ASOS reported a peak wind gust of 52 knots at 1629 EDT.,A cold front triggered numerous severe thunderstorms across central Pennsylvania during the afternoon and evening. The strongest storms organized into intense bowing line segments and produced extensive downburst straight line wind damage and isolated one-inch diameter hail.,41.25,-76.92
255455,10/1/2010 7:30,52,MG,A severe thunderstorm produced a wind gust of 60 mph in Ewing Township.,A convective squall line of showers and isolated thunderstorms that formed along a cold front produced strong to locally severe wind gusts during the early morning of October 1st in central New Jersey.,40.2671,-74.765
265255,10/26/2010 14:04,52,MG,"A severe thunderstorm wind gust was measured at 60 mph, with 8 to 10 inch tree limbs down.","One of the strongest areas of low pressure to impact the lower 48 states moved across the northern United States on October 26. This storm system brought severe weather to much of the central United States. In central Indiana, 2 tornadoes along with numerous straight line wind events were reported. A line of severe thunderstorms ahead of the cold front sped across central Indiana during the morning. A brief tornado touchdown was confirmed about two and a half miles east of downtown Kokomo near County Roads 300 East and 50 North. In addition, significant damage was observed in and near Wilkinson in Hancock County.  The NWS ground survey has determined that both tornado and straight line wind damage occurred with estimated wind speeds of up to 80 mph. Numerous other straight line wind events were reported from across Central Indiana.",40.22,-85.77
275226,12/1/2010 19:25,52,MG,A gust of 60 mph was measured at the Hastings-on-Hudson Municipal Building.,"An approaching cold front triggered isolated severe thunderstorms, which impacted parts of Westchester County.",40.9957,-73.8838
241350,6/28/2010 20:40,53,MG,A severe thunderstorm caused wind damage across central Sussex County in and to the north of Georgetown. The cab cover of one vehicle was torn off one truck and damaged a nearby cars windows. Downed wires were reported on Delaware State Route 113 in Georgetown. A mesonet site five miles north of Georgetown measured a wind gust to 61 mph.,An approaching cold front helped trigger strong to locally severe thunderstorms during the afternoon of the 28th across the southern half of Delaware.,38.744,-75.414
231036,6/16/2010 1:56,53,MG,nan,"A Mesoscale Convective System developed along a surface wave over Illinois and Indiana during mid to late afternoon. It evolved into a squall line as it moved into the area, although there were some discrete storms that developed out ahead of the squall line. The squall line weakened as it progressed east across the area through the evening hours.",39.8,-84.25
245990,6/24/2010 22:37,53,MG,A severe thunderstorm produced a measured wind gust of 53 knots at the Rochester Airport.,A short wave trough moving across southern Canada provided broad scale ascent and instability which led to the development of thunderstorms in the afternoon. Strong winds aloft (>50KT at 700mb) provided enough shear for organization and primarily a wind threat. There were numerous reports of wind damage from bow echoes and one supercell that moved across southeast New Hampshire.,43.28,-70.93
235950,6/19/2010 0:18,53,MG,nan,"A strong mid level trough and resultant increased wind field interacted with a stationary boundary and moderate instability. A long lived squall line developed across Illinois and moved east into northern Indiana. Numerous reports of trees, tree limbs and power lines were blown down with winds more than 70 mph at times.",41.07,-85.01
235898,6/19/2010 1:23,53,MG,nan,"A strong mid level trough and resultant increased wind field interacted with a stationary boundary and moderate instability. A long lived squall line developed across Illinois, moved through northern Indiana and into northwestern Ohio. The line was beginning to lose some strength but did produce reports of trees, tree limbs and power lines down.",40.92,-84.06
235789,6/23/2010 18:05,53,MG,Paulding County Emergency Management measured 61 mph gust at Emergency Management Agency office.,"The remnants of a line of thunderstorms that moved through much of Lower Michigan spread into northwestern Ohio, allowing for a few thunderstorms to affect the area.  Some of these did become locally severe, but dissipated by mid afternoon.",41.1318,-84.5866
245155,8/4/2010 17:25,53,MG,nan,"A very unstable air mass was in place with temperatures in the 90s and dew points in the upper 70s.  While forcing was weak, there was enough lift ahead of a mid-level impulse to spark widespread convection in the form of a mesoscale convective system.",39.8098,-84.2433
248768,8/6/2010 21:57,53,MG,The Charleston International Airport ASOS measured a wind gust of 61 miles per hour.,"Widespread surface heating and continued deep moisture advection ahead of an approaching cold front from the northwest allowed for very unstable atmospheric conditions with CAPE values between 3500 to 4000 J/kg Friday afternoon and evening. As a 500 mb shortwave tracked along the southern periphery of a broad through and across the region, severe thunderstorms developed across the area. Severe thunderstorms initially developed along the seabreeze in the Charleston area late in the afternoon. More organized severe storms tracked into the area from the Midlands during the evening and pushed all the way to the coast, with the strongest storms across southeast South Carolina.",32.9,-80.04
256726,8/11/2010 21:55,53,MG,nan,A weak upper level system and moderate instability allowed for thunderstorms to develop. A lack of overall shear resulted in the storms producing isolated wind damage as cells collapsed or cold pools established.,41.18,-84.58
245596,8/15/2010 19:59,53,MG,nan,Isolated severe weather developed during the afternoon hours of August 15th.  The main threat was damaging winds.,40.3005,-84.1768
230159,6/3/2010 1:14,53,MG,The Zanesville ASOS reported of thunderstorms wind gust of 61 MPH.,"As a cold front moved southeast across the upper Ohio Valley, scattered severe thunderstorms developed across eastern Ohio, western Pennsylvania, and northern West Virginia. A supercell thunderstorm produced an EF1 tornado in Carroll and Jefferson counties in Ohio, with numerous reports of wind damage and hail up to golf ball size elsewhere. Flooding of streams and creeks also occurred over eastern Ohio and the northern panhandle of West Virginia.",39.9411,-81.8884
246420,6/6/2010 20:00,53,MG,An anemometer at the Clay Center Observatory recorded a wind gust of 61 mph.,"A cold front moved through southern New England, returning as a warm front the following day.  Storms fired along the warm front, producing significant wind damage and localized flooding.  One of these storms produced a macroburst that affected much of the Boston metro area with 60 to 70 mph winds with isolated pockets of winds up to 80 mph.  This resulted in significant wind damage across portions of Middlesex, Norfolk, Suffolk, and Essex counties.",42.3092,-71.1345
226245,6/20/2010 18:30,53,MG,Savannah River Site reported a wind gust to 61mph.,Scattered thunderstorms developed over the CWA and produced some hail and wind damage.,33.32,-81.73
