event_id,beginUTC,magnitude,magnitude_type,event_narrative,episode_narrative,location_1_lat,location_1_lon
223070,6/2/2010 0:21,53,MG,nan,"A cold front moved into Iowa from the northwest, while a warm front pushed into the southwest part of Iowa from the south during the afternoon and evening hours.  Initially the airmass was very dry, however a strong push of moisture increased surface dew points into the upper 60s to low 70s by mid afternoon.  Precipitable water values increased to 1.25 to 1.5 inches.  The atmosphere destabilized by mid to late afternoon.  Most unstable CAPE increased to 5000 J/kg as the lifted index fell to -9 to -12 C.  The freezing level was relative low, around 12,000 feet.  Available CAPE in the -10 to -30 C layer of the atmosphere increased to between 500 and 1000 J/kg.  Downdraft CAPE was between 800 and 1000 J/kg.  The atmosphere was moderately sheared with 40 to 55 kts of effective shear in the near storm environment.  With the relatively dry air initially on the leading edge of the developing storms, the LCL was a relatively high 1500 meters.  Thunderstorms formed in two areas.  The first was over northwest Iowa along the cold frontal boundary.  The second area developed over eastern Nebraska and tracked east in the warm advection area along and north of the warm frontal boundary.  The two areas of storms combined during the evening hours, becoming a full fledged MCC by mid evening.  All modes of severe weather occurred with this system, though the predominate mode was large hail.  Thunderstorms formed rapidly along the warm frontal boundary during the mid and late afternoon.  Hail up to baseball size was reported in southwest Iowa with these storms.  Rapid intensification led to golf ball and larger hail in Taylor, Ringgold, Adams, and Union Counties.  One of the storms produced a tornado as it moved through Ringgold County in the Tingley area.  A large farmstead was hit, causing $4,000,000 damage.  Eight buildings were damaged or destroyed, as well as the farmstead itself.  Based upon extensive destruction to a 400 foot long metal cattle barn on the farmstead, it was determined that the tornado was of EF-2 strength with winds of up to 130 MPH.  Other buildings, including the home, received extensive damage but not as widespread.  Three head of cattle were killed when the cattle barn was destroyed.  During the early evening the storm system transitioned into more of a high wind event.  Several reports of 50 to 70 MPH winds were received.  A wind gust in excess of 60 MPH threw house debris onto the street in Ottumwa.  The storms produced heavy rainfall of 2 inches or more per hour.  Fortunately they were moving relatively quickly.  Storms trained over parts of Guthrie County.  Over 4 inches of rain fell north and west of Guthrie Center.  The heavy rainfall caused minor flooding with ditches filled and minor road flooding.  A small area of flash flooding was reported along Seely Creek in Guthrie County with water a few feet over the road.  Lightning caused at least two house fires.  A house was struck east of Des Moines by one thunderstorm.  The house was set on fire by the lightning.  A second house was struck and set ablaze north of Ankeny.",41.11,-92.45
242226,6/11/2010 7:53,53,MG,nan,"Thunderstorms produced damaging winds over a large part of northwest Iowa, especially near the western border of the state, during the predawn hours of June 11th. The storms also produced very heavy rain, which caused flash flooding at several locations.",42.45,-96.36
236936,6/12/2010 7:49,53,MG,nan,"Multiple rounds of severe thunderstorms, mainly producing damaging winds and torrential rainfall, made for a very active Friday evening and early Saturday morning across much of South Central Nebraska. The initial wave of severe storms developed during the mid to late evening hours, mainly west of Highway 183 in the vicinity of a quasi-stationary surface front draped from Northwest Kansas to East Central Nebraska. With surface dewpoints pushing the low 70s in many areas, the airmass was quite unstable as storms organized, with MLCAPE values into the 3000-4000 J/kg range. A few of these initial storms were supercells, with one producing a brief EF0 tornado shortly after nightfall in central Gosper County with no damage reported.   As the initial cluster of storms pushed east toward the Highway 281 corridor toward midnight, wind damage became increasingly common. Southern Adams County was one of the hardest hit areas, with grain bins blown onto railroad tracks in Ayr, and signficant tree damage and some structural damage just north of Ayr at Crystal Lake. As this intial wave of storms weakened somewhat, another severe squall line surged into western sections of South Central Nebraska after midnight, aided by strong convergence along the nose of a 40-50 knot low level jet. With this line of late-night storms, damaging winds were not only reported along the leading edge of the outflow, but also in association with a wake low pressure system that developed behind the main squall line. These winds associated with the wake low pounded western Dawson County for several minutes, with reports of uprooted trees and damage to signs and a gazebo in Cozad. As the leading edge of the bowing squall line reached the Highway 281 corridor after 2 am, Adams County was again struck with damaging winds clocked as high as 73 MPH at the Hastings airport. Winds gusts in excess of 60 MPH also pressed east through the Aurora and York areas.   In addition to fairly widespread wind damage, portions of South Central Nebraska received heavy rainfall of 2 to 4 inches during the night. With the ground already saturated in areas mainly north of Interstate 80, flooding resulted. One of the most noteworthy flash flooding events affected the community of North Loup in Valley County along the Mira Creek. A dam break on the Bredthauer Dam, located approximately five miles northwest of town, allowed 1 to 2 feet of water to inundate much of North Loup on Saturday afternoon, with evacuations necessary.",40.88,-98
242926,6/12/2010 22:59,53,MG,The report was from a KSN-TV weather lab.,"A stationary frontal boundary draped across Central Kansas helped lead to the development of showers and thunderstorms across the region late in the afternoon of June 12th, 2010.  Abundant moisture along this frontal boundary led to the development of supercell thunderstorms with a few weak tornadoes, which mainly touched down in open fields.  The thunderstorms evolved into a line of storms and eventually led to an extended period of heavy rainfall during the overnight hours of June 12th into the early morning hours on June 13th, with some widespread flooding in Central Kansas.  The areas hit the hardest with flooding were just to the north and northeast of Hutchinson, Kansas, and to the northeast of Newton, Kansas near Peabody, Kansas.",38.3717,-98.7844
242214,6/17/2010 22:44,53,MG,A storm spotter measured a 53 knot wind gust.,"Several strong storms developed in west-central Minnesota during the mid afternoon hours of June 17th.    These storms quickly become severe and produced softball size hail northwest of Alexandria and a tornado near Leaf Valley that became the EF-4 that moved through Wadena, Minnesota.    By the late afternoon, numerous thunderstorms developed across southern Minnesota along the leading edge of extreme instability.   Numerous funnel cloud reports and a few brief tornado touchdowns were noted prior to 5 pm, but once the low level shear (0-1 km) increased significantly from 15 knots, to over 35 knots, strong tornadoes developed along the Iowa border.   These storms along the Iowa border produced a series of long-lived tornadoes near Albert Lea, Minnesota. Very large hail also accompanied some tornadoes along with flash flooding.",43.66,-94.07
227067,6/18/2010 2:54,53,MG,The automated weather observing equipment at the Winona airport reported a peak wind gust of 61 mph.,"Severe thunderstorms developed during the evening of June 17th along a warm front that was lifting north through southern Minnesota and northeast Iowa. These severe thunderstorms produced the first tornadoes of 2010 for southeast Minnesota with three confirmed tornadoes. Two of these occurred in rural portions of Dodge County while the third moved through the northwest side of Rochester (Olmsted County). The tornadoes in Dodge County were rated EF0 and EF1 on the Enhanced Fujita Scale while the tornado in Rochester was rated EF1. The tornado in Rochester was the first to occur within the city limits since August 1995. As the storms progressed east, they became prolific wind producers with wind gusts of 60 to 80 mph across Olmsted and Winona Counties. Numerous buildings were damaged or destroyed with most of this occurring from Rochester east through the Winona area (Winona County).  Federal Disaster Declarations for public assistance were designated for Olmsted and Houston Counties in southeast Minnesota.",44.05,-91.66
240137,6/18/2010 20:45,53,MG,nan,A line of severe thunderstorms moved from Iowa into northwest Illinois during the mid afternoon hours and then raced east across northern Illinois producing damaging winds as high as 90 mph.  These thunderstorms produced widespread wind and tree damage across northern Illinois. More than half a million customers lost power during the storms.,41.9,-88.25
246625,6/23/2010 4:30,53,MG,nan,Many severe thunderstorms developed along a stationary front extending across the region. Damaging winds occurred along with very heavy rains which resulted in flash flooding.,44.25,-98.76
241385,6/23/2010 23:45,53,MG,nan,Severe thunderstorms moved across northwest Indiana during the afternoon and evening hours of June 23rd producing widespread wind and tree damage as well as flash flooding.,41.62,-87.42
246235,6/26/2010 22:35,53,MG,nan,"Thunderstorms produced numerous reports of damaging winds, along with several reports of flash flooding and one large hail report, across southwest Minnesota during the late afternoon and early evening of June 26th.",44.45,-95.79
240601,6/28/2010 2:35,53,MG,The Texas Tech University West Texas Mesonet site near Levelland measured a thunderstorm wind gust of 61 mph shortly after 20:30 CST. No damage was reported.,"A complex of thunderstorms impacted the west Texas South Plains during the evening hours of the 27th. The storms produced small hail, at least one instance of severe winds, and heavy rainfall. The most significant impacts occurred in Floyd County where heavy rainfall resulted in flash flooding along Texas Highway 207. No damages were reported.",33.5221,-102.37
249764,7/10/2010 23:28,53,MG,nan,"Thunderstorms produced large hail and damaging winds at several locations in southeast South Dakota, mostly near Interstate 90, during the late afternoon and early evening of July 10th. The storms also produced heavy rain and flash flooding in Mitchell, and in the Platte area of Charles Mix County.",43.65,-98.89
247854,7/11/2010 20:58,53,MG,An automated weather station reported a 53 knot gust.,"Convective clusters with bowing segments and a few supercells produced scattered wind damage and a few reports of hail. In addition, heavy rainfall in excess of three inches occurred at some locations resulted in localized flash flooding.",37.71,-92.16
249643,7/13/2010 1:55,53,MG,Wind gusts to 61 mph were recored by a home anemometer.,"An area of showers and thunderstorms formed in a moisture rich airmass across Middle Tennessee ahead of an approaching frontal system during the evening hours on Monday, July 12th. Some of these thunderstorms reached severe thresholds, producing thunderstorm wind, flash flood, heavy rain, and lightning damage across several counties in the mid state.",35.57,-87.19
232968,7/14/2010 23:45,53,MG,Local weather equipment measured a thunderstorm wind gust of 61 mph.,"Thunderstorms developed in a southwest to northeast line along a cold front that pushed across eastern Nebraska and western Iowa during the late afternoon and evening of July 14th.  Ahead of the front temperatures climbed into the mid 90s with dew point temperatures in the mid 70s to around 80.  This created a very unstable environment for the storms.  As the storms encountered the extremely unstable conditions they increased in strength, and besides producing very heavy rain, wet micro-bursts developed with some of the storms.",41.37,-96.57
249565,7/18/2010 4:12,53,MG,nan,"Two distinct rounds of severe weather affected South Central Nebraska on this Saturday, one during the very early morning hours, and another, more widespread event that rolled in during the mid to late evening hours. The first round of storms flared up around midnight, in a northwest-southeast corridor stretching from Dawson County to Franklin County. These storms initiated along a rather subtle low to mid level convergence zone, in a very unstable airmass featuring 4000-5000 J/kg most-unstable CAPE and 30-40 knots of deep-layer vertical wind shear. Severe weather reports included estimated wind gusts to 60 MPH, and hail up to quarter size, along with locally heavy rainfall.   Following a lull that lasted through the day, the evening hours brought one of the most significant severe weather episodes of the summer to the area, as a concentrated swath of damaging 60-90 MPH wind gusts swept eastward along and near the Interstate 80 corridor. These severe storms actually resulted from a merger between storms moving east from Southwest Nebraska, and other storms dropping south from North Central Nebraska. These initial storms developed in closer proximity to a surface cold front and trough axis, trailing southward from low pressure centered over the Dakotas. Around sunset, these smaller storm clusters merged as they entered Dawson and Buffalo Counties, quickly evolving into a forward-propagating mesoscale convective system (MCS) with damaging outflow winds. As storms first entered South Central Nebraska, the mesoscale environment featured 3000-4500 J/kg most-unstable CAPE, and around 30 knots of deep-layer vertical shear. Over the course of around 3 hours, wind damage was widespread near the Interstate 80 corridor, but especially within Buffalo County, where gusts estimated as high as 90 MPH resulted in numerous damage reports. To name just a few, these reports included a roof torn from a home, numerous grain bins damaged or destroyed, and a number of power poles snapped, causing power outages in the area.  Nebraska Public Power District estimated 32 miles of power lines and 218 individual power structures were blown down in the Buffalo County area. Multiple reports were also received of damage to area trees and crops. Farther east, winds were not quite as strong, but still maintained severe levels as gusts to 68 MPH were measured at the Hastings airport, and 61 MPH at the Aurora airport. In addition to severe winds, there were also a few reports of hail during the evening, with the largest being golf ball size north of Lexington.",40.88,-98
233418,7/18/2010 8:20,53,MG,nan,"A very unstable airmass was in place over Iowa as a cold front approached from the west.  High temperatures the previous day were in the upper 80s and 90s for the most part, with 101 at Fairfield.  Dewpoint readings were in the 70s east to near 80 over the west.  CAPE was in the 4000 to 5000 J/kg range with lifted indices of -8 to -11 C.  Downdraft CAPE was quite high, 1200-1400 J/kg.  CAPE in the -10 to -30 C layer of the atmosphere was between 300 and 500 J/kg.  The atmosphere was quite strongly sheared with 45 to 60 kts of shear.  Precipitable water was low, only 1 to 1.5 inches.  With the relatively dry air, the LCL was between 1500 and 2500 meters.  The airmass was also quite warm with the freezing level around 15,600 feet.  Thunderstorms formed in two clusters.  One extended from Minnesota southwest into eastern South Dakota.  The other area was over central Nebraska.  The convective area from South Dakota dropped southeast into Iowa during the late evening hours.  It produced high winds and hail as it did.  Hail was not the major mode of severe weather.  Most of the larger hail occurred during the early stages of the storm.  Golf ball size hail fell west of Graettinger in Palo Alto County for the largest hail report.  The cluster of storms organized into a small derecho as it approached Fort Dodge.  The derecho raced southeast through the Des Moines area and into southeast Iowa.  It produced some hail as it did, but by in large high winds were the primary threat.  Winds of 60 to 75 MPH were common, causing considerable tree damage.  High winds of 65 to 75 MPH roared through Ames.  A shelter at the Iowa State Veterinary Medicine School was blown over.  Several horses were injured by the collapse.  University officials has to euthanize one horse due to severe injuries.  A measured wind gust of 84 MPH was recorded on the northwest side of the Des Moines Metro area.  Power was knocked out to nearly 40,000 customers in central Iowa by the storms.  Damage reports from along the path of the derecho were widespread.  Grain bins were destroyed as well as numerous out buildings.  Tree and power line damage was extensive all the way from the Minnesota border through south central Iowa.  Heavy rain was also an issue with the storms.  Rainfall of 1 to 2 inches per hour fell with the storms from Fort Dodge into the Des Moines area.  Flash flooding was reported in Marion County.  Heavy rainfall of 2 to 4 inches in under 2 hours flooded city streets in Knoxville, some 4 feet deep, with cars stalled in city streets.  Water was also over the road southeast of Melcher-Dallas in Marion County.  Flash flooding was reported in Webster City.  Flooding blew manhole covers off and stalled several cars in the city.  As the storm moved through the Raymond area of Black Hawk County, lightning struck a house.  It blew a basketball size hole in the roof and caused electrical damage to the house and some structural damage to ceilings.",41.53,-93.66
243271,7/19/2010 21:00,53,MG,Trees and power lines were blown down. A wind gust was measured at 61 mph.,"A bowing line of thunderstorms raced eastward across Illinois and Indiana at 45 mph. The trailing southern end of the bow crossed southwest Indiana, accompanied by locally damaging winds. The line of storms may have been initiated by a weak upper level disturbance entering northern Illinois. As it moved east, the line gained strength as it fed on a very moist and unstable air mass.",38.33,-87.35
235825,7/20/2010 5:07,53,MG,nan,"Thunderstorms moved from northeast Colorado into extreme northern Kansas during the late evening hours, producing wind gusts as high as 81 mph and golf ball sized hail.  some tree limb and power pole damage occurred.",39.85,-99.89
249386,7/20/2010 23:42,53,MG,nan,"A frontal boundary served to focus additional severe thunderstorm activity, during the late afternoon and evening hours of July 20, 2010.",38.73,-93.55
254372,7/22/2010 22:06,53,MG,"A trained spotter measured a thunderstorm wind gust at 61 mph (53 knots) 4 miles west of Brown Deer. The wind gusts snapped small trees, with trunks about 6 inches in diameter.","A stalled frontal boundary combined with a moist and unstable atmosphere and strong wind shear to produce numerous tornadoes and funnel clouds over South Central and Southeast Wisconsin. A series of vorticity maxima moving west to east through the western Great Lakes enhanced isentropic lift, as a strengthening southerly low-level jet interacted with a nearly stationary west to east warm front.",43.17,-88.0494
252475,7/24/2010 2:55,53,MG,nan,"Thunderstorms produced large hail, damaging winds, and brief tornadoes in southeast South Dakota during the evening of July 23rd. The storms moved east and affected the area mainly near and south of Interstate 90. However, the storms affected an area further north, including Brookings, when they arrived near the eastern border of South Dakota. Flash flooding resulted in the Brookings area.",44.3,-96.81
257874,8/4/2010 11:55,53,MG,nan,Strong to severe thunderstorms moved across parts of northern Illinois during the morning hours of August 4th.,42.1031,-87.8127
240038,8/10/2010 22:56,53,MG,Measured by a schoolnet site.,"Once again the atmosphere over Iowa became very unstable during the peak heating of the day.  CAPE rose to 3500-4500 J/kg by the mid to late afternoon with lifted indices of -8 to -10 C.  The moisture pooled over the state with precipitable water values approaching 2 inches by evening.  High temperatures reached the upper 80s to low 90s, with dewpoints topping out in the upper 70s to low 80s.  The atmosphere was fairly weakly sheared with 30 kts of available shear.  Downdraft CAPE was between 1000 and 1800 J/kg.  Available CAPE in the -10 to -30 C layer of the atmosphere was 800-1100 J/kg, but hail was limited by the high freezing level, 16,000 to 16,500 feet.  Quarter size hail fell in Calhoun County as an intense storm passed though.  The same storm cluster produced a funnel cloud in Sac County earlier.  Scattered winds occurred with the storms.  A 61 MPH wind gust was recorded in Eagle Grove for example and windows were blown out in Humboldt County south of Thor.  One of the thunderstorms produced a tornado in Emmet County.  The tornado touched down briefly over Lake Iowa.  Thunderstorms became more organized during the evening and produced very heavy rainfall.  In addition to the rainfall, scattered reports of high winds and some hail up to an inch and one quarter in size were received.  Most of the wind reports were around 60 MPH.  By far the most significant weather was the heavy rainfall.  Three to 5 inches of rain fell on saturated ground, resulting in a very widespread flash flood event.  Nearly half of the CWA was involved from parts of north central Iowa south to the Missouri border.  Numerous roads were covered with flowing water of 1 to 2 feet in depth.  Lightning struck a car at mile post 105 on Interstate 35 in Story County.  No injuries were reported.  Lightning also struck a house in Ankeny, causing a fire.  The flash flooding claimed one life in central Iowa.   Three vehicles were swept into the waters of Mud Creek near Altoona in Polk County.  There were 11 people involved.  A rescue call was made to save the occupants of the cars.  One 16 year old female perished in the flood waters, the other 10 were rescued, though 4 were injured and received treatment at a local hospital.  The flash flooding transitioned into widespread flooding as the night progressed into the day of the 11th.  Flash flooding resulted in evacuations of apartments and trailer courts on the east side of Des Moines.  Interstate 35 was covered by water due to flash flooding at mile post 97.  Several cars spun out in the flood waters.  Very intense rainfall in the Ames area resulted in a record crest on Squaw Creek.  The creek crested 1.5 to 2.5 feet above the record high stage.  Major flooding took place and the water treatment plant was inundated.  Major damage was done to several buildings on the Iowa State Campus.  Damage to Iowa State alone was between $40,000,000 and $50,000,000.  Flooding from the Skunk River closed U.S. Highway 30.  Thirty people were rescued at a Wal-Mart store in Ames as well.  Following the severe flooding, several Iowa counties were added to the Presidential Disaster Declaration number 1930.  The original 32 were: Adams, Appanoose, Audubon, Buena Vista, Butler, Cherokee, Clay, Davis, Decatur, Franklin, Howard, Humboldt, Iowa, Lee, Lyon, Madison, Marion, Mills, Monroe, Montgomery, O’Brien, Osceola, Palo Alto, Ringgold, Shelby, Union, Van Buren, Wapello, Warren, Wayne, Webster and Wright.  Eighteen were added to the original, incuding: Black Hawk, Boone, Buchanan, Clayton, Delaware, Dickinson, Dubuque, Emmet, Fayette, Guthrie, Jackson, Jasper, Jones, Lucas, Mahaska, Polk, Sioux and Story.  In addition, Governor Chet Culver had issued disaster proclamations for 50 Iowa counties due to inclement weather since June 1, 2010: Appanoose, Black Hawk, Boone, Buchanan, Buena Vista, Butler, Cherokee, Clay, Clayton, Davis, Decatur, Delaware, Dickinson, Dubuque, Emmet, Fayette, Franklin, Hamilton, Hancock, Howard, Humboldt, Jackson, Jasper, Jefferson, Johnson, Jones, Kossuth, Lee, Lucas, Lyon, Mahaska, Marion, Monona, Monroe, OBrien, Osceola, Palo Alto, Polk, Ringgold, Shelby, Sioux, Story, Taylor, Union, Van Buren, Wapello, Warren, Washington, Webster and Wright.",42.67,-93.9
262272,8/14/2010 2:46,53,MG,nan,Strong to severe storms developed across portions of the region with some isolated severe weather reported.,38.82,-92.22
257712,8/15/2010 1:53,53,MG,nan,"A quasi stationary boundary and a strong upper level disturbance helped lead to the development of severe thunderstorms across most of South Central Kansas during the evening hours of August 14th, 2010.  Strong differential heating from an oppressively warm airmass lead to the development of multicell and even a few supercell thunderstorms.  The severe thunderstorms led to numerous damaging wind events across Southern Kansas.",37.16,-97.03
257285,8/20/2010 1:59,53,MG,nan,Thunderstorms produced damaging winds at several locations along a long path from Gregory to Brookings Counties in southeast South Dakota during the evening of August 19th. There was also one report of marginally large hail.,43.73,-98.03
257290,8/20/2010 3:18,53,MG,nan,Thunderstorms produced damaging winds at several locations along a long path from Gregory to Brookings Counties in southeast South Dakota during the evening of August 19th. There was also one report of marginally large hail.,43.54,-96.73
