event_id,beginUTC,magnitude,magnitude_type,event_narrative,episode_narrative,location_1_lat,location_1_lon
250491,8/10/2010 1:50,59,MG,nan,"Severe Thunderstorm Watch number 595 was issued for west and north central North Dakota for the late afternoon and evening hours of Monday, August 9th. This was in anticipation of strong to severe thunderstorms developing along a surface front lifting across the state, combined with increasing ascent with the approach of an upper level impulse.     Multiple severe thunderstorm warnings were issued. Numerous reports of large hail and several reports of severe thunderstorm wind gusts were received during this episode.",48.47,-101.71
262124,9/11/2010 2:28,59,MG,Emporia Automated Surface Observing System (ASOS) measured two wind gusts of 68 mph.,"On the evening of Friday September 10, 2010 a cold front pushed through northeast Kansas, and kicked off a round of thunderstorms which brought strong damaging winds to areas near Topeka.  Trained spotters around the area reported wind gusts of 60 to 70 mph. These wind gusts caused tree limbs up to 10 inches in diameter to break.  The Automated Surface Observation System (ASOS) site at Emporia measured a 68 mph wind gust, while the ASOS station at Forbes Field, south of Topeka, measured a gust of 55 mph. Aside from the widespread strong winds the storms produced large hail up to the size of golf balls in isolated locations.",38.4,-96.18
254679,8/12/2010 5:47,59,MG,nan,"A mid level trough ejecting northeast through the Northern Rockies, combined with a stalled frontal boundary, resulted in strong to severe thunderstorm development across central Montana in the late afternoon. These storms continued to move and develop eastward into western and portions of central North Dakota during the evening hours of Wednesday, August 11th and into the early morning of Thursday, August 12th.   Multiple severe thunderstorm warnings were issued. Several reports of large hail and multiple reports of severe thunderstorm wind gusts were received during this episode.",46.68,-100.23
228340,4/24/2010 19:29,59,MG,Large tree limbs were downed due to thunderstorm winds.,A deep upper low tracked into the region bringing widespread rainfall and isolated severe weather.  Limited instability in conjunction with a vigorous shortwave generated a couple of bands of strong to isolated severe convection.  These storms produced several severe wind reports and one EF-0 tornado on Table Rock Lake in Taney County.,36.95,-93.31
225545,4/6/2010 21:39,59,MG,The Lawrence Municipal Airport ASOS machine reported a 68 mph wind gust.,"On the afternoon of April 6th, 2010 a line of storms formed along a dry line  in central Kansas.  These storms produced large hail up to golfball sized and and damaging winds near 70 mph across the area. By 4:00 pm the line of storms moved into east central Kansas and affected Lawrence.  Severe winds ripped through the northern portions of town causing significant damage to some of the neighborhoods along and north of 6th Street.  The Lawrence Airport ASOS reported a wind gust of 68 mph at 4:39 pm.  No structures were reported as being damaged, however, many trees greater than 24 inches in diameter were snapped as a result of the strong winds.  After the winds left the area heavy rain affected Lawrence for a couple hours thereafter and caused minor street flooding.",38.96,-95.26
221689,4/21/2010 0:48,59,MG,National Weather Service damage survey indicated that wind blown hail damaged residences and several other nearby residences. North facing windows blown out and north facing siding were damaged along with hundreds of acres of crops destroyed.  The wind damage was likely due to the rear flank downdraft.,Severe thunderstorms moved across the southwest and south central Texas Panhandle during the evening hours producing large hail...damaging winds...and two tornadoes. Although no injuries were reported...the hail and winds caused damage to homes and crops.,34.99,-102.07
214035,4/2/2010 16:12,59,MG,nan,"The seasons first severe weather occurred around mid day on the 2nd.  Strong and deep southerly flow was in place across the central U.S.  Low pressure at the surface moved from southwest Kansas on the evening of the 1st, to eastern North Dakota by early afternoon of the 2nd.  A cold front extending south from the low moved into Iowa on the morning of the 2nd.  A low level jet of 40 to 50 kts was in place during the morning of the 2nd.  The upper level jet was around 100 kts at the time.  The overall sounding was nearly unidirectional.  There was limited CAPE available, around 500 J/kg of elevated CAPE, but sufficient dynamics were in place.  The 0-1 km shear was between 30 and 40 kts.  Thunderstorms developed along the cold front and moved rapidly northeast at 70 to 80 MPH across southern Iowa.  The storms produced sub-severe hail and winds of 60 to 70 MPH as they passed.  High winds blew a grain bin across a street, downed large tree branches, and tore siding off of a house in Decatur County.  Street signs were damaged in Lacona in Warren County, while part of a roof was torn off in Marion County at Columbia.  The storms weakened during the early afternoon hours, but still produced winds as the moved into central and northeast Iowa.  A 59 MPH wind gust was recorded at the Waterloo Airport.  Overall damage was limited, in part due to the fact that the trees had not leafed out yet.",40.74,-93.75
218960,4/6/2010 0:15,59,MG,"A 68 mph wind gust was recorded by the AWOS at the Monticello Municipal Airport just southeast of Monticello, IA at 715 pm April 5.","April 5th started off with sunny skies which helped to warm things up. The sun in addition to a developing low pressure system in Kansas pushed a warm front northward into Iowa. The front stalled out along and south of Highway 34, leaving areas north of the boundary in the 60s, while those to the south rose into the 70s.  The sunshine coupled with increasing moisture levels resulted in thunderstorm development during the afternoon and evening. Some of the thunderstorms were severe, producing large hail and damaging winds.",42.2225,-91.1624
224232,4/6/2010 3:47,59,MG,nan,Strong to severe thunderstorms moved across northern Illinois during the evening hours of April 5th into the early morning hours of April 6th.  Large hail and wind damage were reported in many areas.  Hail the size of baseballs was reported in Des Plaines.,41.98,-87.9
226039,4/6/2010 22:44,59,MG,"Thunderstorm wind gust was measured at 68 mph, at the intersection of I-435 and Kansas Avenue.","Severe thunderstorms brought large hail and damaging winds to the area, during the afternoon hours of April 6, 2010.",39.12,-94.73
225191,4/24/2010 20:51,59,MG,nan,"A strong storm system moved through the region, triggering showers and thunderstorms.  Numerous reports of large hail, damaging winds, tornadoes and flash flooding were reported with this system.",38.33,-90.68
227738,4/24/2010 22:42,59,MG,The public reported a measured wind gust of 59 knots.,"A severe squall line developed in advance of an occluded front moving across central Kentucky.  This squall line produced widespread wind damage across south central Kentucky and into the Bluegrass region.  In addition, two brief tornadoes touched down in Mercer and Edmonson counties.",37.23,-86.38
231575,5/13/2010 7:20,59,MG,nan,"A line of thunderstorms developed along a cold front that swept through the region during the early morning hours of the 13th. Storms also developed ahead of a dry line in the eastern Texas panhandle. Very strong winds and marginally severe hail accompanied the line of thunderstorms. The winds produced damage, especially over Wichita and Clay counties.",34.09,-98.5425
236189,5/28/2010 20:58,59,MG,A 68 mph wind gust was measured by a firefighter.  Trees were blown down onto power lines on AL-9 east of Cedar Bluff.,"A warm and unstable air mass, combined with a slow moving upper level disturbance, led to the formation of numerous thunderstorms across Central Alabama over a three day period.  Many of the storms produced damaging winds, large hail, and heavy rainfall.",34.2306,-85.5526
227613,6/8/2010 4:43,59,MG,nan,"An area of low pressure became the focus for supercell thunderstorm development across the Nebraska panhandle on June 7, 2010. As the storms developed east into western Nebraska during the evening the thunderstorms evolved into a line of strong to severe thunderstorms. The storms produced numerous reports of damaging winds as the line moved southeast across western Nebraska.",41.48,-99.92
236927,6/12/2010 6:39,59,MG,nan,"Multiple rounds of severe thunderstorms, mainly producing damaging winds and torrential rainfall, made for a very active Friday evening and early Saturday morning across much of South Central Nebraska. The initial wave of severe storms developed during the mid to late evening hours, mainly west of Highway 183 in the vicinity of a quasi-stationary surface front draped from Northwest Kansas to East Central Nebraska. With surface dewpoints pushing the low 70s in many areas, the airmass was quite unstable as storms organized, with MLCAPE values into the 3000-4000 J/kg range. A few of these initial storms were supercells, with one producing a brief EF0 tornado shortly after nightfall in central Gosper County with no damage reported.   As the initial cluster of storms pushed east toward the Highway 281 corridor toward midnight, wind damage became increasingly common. Southern Adams County was one of the hardest hit areas, with grain bins blown onto railroad tracks in Ayr, and signficant tree damage and some structural damage just north of Ayr at Crystal Lake. As this intial wave of storms weakened somewhat, another severe squall line surged into western sections of South Central Nebraska after midnight, aided by strong convergence along the nose of a 40-50 knot low level jet. With this line of late-night storms, damaging winds were not only reported along the leading edge of the outflow, but also in association with a wake low pressure system that developed behind the main squall line. These winds associated with the wake low pounded western Dawson County for several minutes, with reports of uprooted trees and damage to signs and a gazebo in Cozad. As the leading edge of the bowing squall line reached the Highway 281 corridor after 2 am, Adams County was again struck with damaging winds clocked as high as 73 MPH at the Hastings airport. Winds gusts in excess of 60 MPH also pressed east through the Aurora and York areas.   In addition to fairly widespread wind damage, portions of South Central Nebraska received heavy rainfall of 2 to 4 inches during the night. With the ground already saturated in areas mainly north of Interstate 80, flooding resulted. One of the most noteworthy flash flooding events affected the community of North Loup in Valley County along the Mira Creek. A dam break on the Bredthauer Dam, located approximately five miles northwest of town, allowed 1 to 2 feet of water to inundate much of North Loup on Saturday afternoon, with evacuations necessary.",40.46,-99.27
234896,6/14/2010 1:35,59,MG,A storm chaser measured a thunderstorm wind gust of 68 mph east of Floydada along U.S. Highway 62/70. Visibility was reportedly near zero with torrential wind-driven rainfall.  No damage was reported.,"Thunderstorms developed along and east of a dryline over the west Texas South Plains and Rolling Plains during the afternoon and evening hours on the 13th.  Several of the storms became severe and produced large hail up to the size of golfballs and wind gusts up to 68 mph.   During the late evening hours, thunderstorms congealed into a small convective complex over the extreme southern Panhandle and the northern Rolling Plains.  These storms produced severe wind gusts in Childress and Hall counties.  A particularly intense downburst was sampled by the Texas Tech University West Texas Mesonet near Turkey around 23:30 CST, with a peak wind gust of 101 mph.  These winds destroyed a trailer home and heavily damaged a large metal barn and utilities.",33.98,-101.1729
240306,6/18/2010 20:35,59,MG,nan,A line of severe thunderstorms moved from Iowa into northwest Illinois during the mid afternoon hours and then raced east across northern Illinois producing damaging winds as high as 90 mph.  These thunderstorms produced widespread wind and tree damage across northern Illinois. More than half a million customers lost power during the storms.,41.74,-88.2
244328,6/19/2010 16:57,59,MG,nan,"A small cluster of storms with a bow echo, moved east across eastern Kansas and northern Missouri, during the morning hours of June 19, 2010. This storm system packed a strong punch, with radar estimated velocities topping out in the 80 to 90 knot range at times.  While the majority of this air speed didnt translate down to the surface, numerous reports of 60, to as high as 70 mph winds, were common from St. Joseph, to Kansas City, Lees Summit, Chillicothe, Sedalia, Moberly, and Columbia.  This storm system remained intact long enough to cross the entire state of Missouri, making it a tri-state complex.",39.77,-94.92
234731,6/22/2010 3:30,59,MG,Wind gust was measured by KSN Weatherlab in Oberlin.,"A complex of intense thunderstorms moved southeast from Yuma county Colorado into northwest Kansas during the evening. One tornado developed in Yuma county, and a long path of large hail and damaging winds occurred over NW Kansas.",39.82,-100.53
246623,6/23/2010 3:00,59,MG,nan,Many severe thunderstorms developed along a stationary front extending across the region. Damaging winds occurred along with very heavy rains which resulted in flash flooding.,43.88,-99.6
246631,6/23/2010 6:31,59,MG,nan,Many severe thunderstorms developed along a stationary front extending across the region. Damaging winds occurred along with very heavy rains which resulted in flash flooding.,44.92,-97.15
233907,6/24/2010 2:28,59,MG,A KVII-TV Schoolnet site in Happy measured a wind gust of 59 mph.  No damage was reported.,Thunderstorm outflow resulted in at least two severe wind gusts as measured by the Texas Tech University West Texas Mesonet and the KVII-TV Schoolnet over the extreme southern Texas Panhandle between 20:00 CST and 21:00 CST.  No damages were reported.,34.73,-101.85
249105,7/13/2010 8:45,59,MG,Several trees six to eight inches in diameter were blown down near Interstate 57 around exit 322.  A 12 inch diameter tree was snapped off at its base.  Numerous trees were blown down on Leahy Circle and on Park Street.  A 10 inch diameter tree was blown down on a house on Leahy Circle.  A tree fell on a car on Park Street.,Strong to severe thunderstorms moved across parts of east central Illinois during the early morning hours of July 13th.,41.2508,-87.8511
249311,7/15/2010 1:08,59,MG,Tree limbs of 4 to 6 inches in diameter knocked down.,"Over the course of 3 hours on this late Wednesday afternoon and evening, a nearly solid line of severe thunderstorms lumbered slowly east-southeast across parts of North Central Kansas, primarily affecting areas east of a line from Smith Center to Plainville. These storms developed along a well-defined, advancing cold front, in a very unstable environment characterized by 3500-5000 J/kg MLCAPE, but only around 30 knots of deep-layer vertical wind shear. In the mid and upper levels, a shortwave trough centered to the north over the Dakotas served as the primary instigator for severe weather. These storms resulted in several reports of damaging wind gusts of 60-70 MPH, mainly across Osborne and Mitchell Counties, along with a few hail reports ranging from penny to quarter size.",39.2529,-98.12
249548,7/18/2010 2:09,59,MG,nan,"Two distinct rounds of severe weather affected South Central Nebraska on this Saturday, one during the very early morning hours, and another, more widespread event that rolled in during the mid to late evening hours. The first round of storms flared up around midnight, in a northwest-southeast corridor stretching from Dawson County to Franklin County. These storms initiated along a rather subtle low to mid level convergence zone, in a very unstable airmass featuring 4000-5000 J/kg most-unstable CAPE and 30-40 knots of deep-layer vertical wind shear. Severe weather reports included estimated wind gusts to 60 MPH, and hail up to quarter size, along with locally heavy rainfall.   Following a lull that lasted through the day, the evening hours brought one of the most significant severe weather episodes of the summer to the area, as a concentrated swath of damaging 60-90 MPH wind gusts swept eastward along and near the Interstate 80 corridor. These severe storms actually resulted from a merger between storms moving east from Southwest Nebraska, and other storms dropping south from North Central Nebraska. These initial storms developed in closer proximity to a surface cold front and trough axis, trailing southward from low pressure centered over the Dakotas. Around sunset, these smaller storm clusters merged as they entered Dawson and Buffalo Counties, quickly evolving into a forward-propagating mesoscale convective system (MCS) with damaging outflow winds. As storms first entered South Central Nebraska, the mesoscale environment featured 3000-4500 J/kg most-unstable CAPE, and around 30 knots of deep-layer vertical shear. Over the course of around 3 hours, wind damage was widespread near the Interstate 80 corridor, but especially within Buffalo County, where gusts estimated as high as 90 MPH resulted in numerous damage reports. To name just a few, these reports included a roof torn from a home, numerous grain bins damaged or destroyed, and a number of power poles snapped, causing power outages in the area.  Nebraska Public Power District estimated 32 miles of power lines and 218 individual power structures were blown down in the Buffalo County area. Multiple reports were also received of damage to area trees and crops. Farther east, winds were not quite as strong, but still maintained severe levels as gusts to 68 MPH were measured at the Hastings airport, and 61 MPH at the Aurora airport. In addition to severe winds, there were also a few reports of hail during the evening, with the largest being golf ball size north of Lexington.",41.02,-100.11
249564,7/18/2010 3:51,59,MG,nan,"Two distinct rounds of severe weather affected South Central Nebraska on this Saturday, one during the very early morning hours, and another, more widespread event that rolled in during the mid to late evening hours. The first round of storms flared up around midnight, in a northwest-southeast corridor stretching from Dawson County to Franklin County. These storms initiated along a rather subtle low to mid level convergence zone, in a very unstable airmass featuring 4000-5000 J/kg most-unstable CAPE and 30-40 knots of deep-layer vertical wind shear. Severe weather reports included estimated wind gusts to 60 MPH, and hail up to quarter size, along with locally heavy rainfall.   Following a lull that lasted through the day, the evening hours brought one of the most significant severe weather episodes of the summer to the area, as a concentrated swath of damaging 60-90 MPH wind gusts swept eastward along and near the Interstate 80 corridor. These severe storms actually resulted from a merger between storms moving east from Southwest Nebraska, and other storms dropping south from North Central Nebraska. These initial storms developed in closer proximity to a surface cold front and trough axis, trailing southward from low pressure centered over the Dakotas. Around sunset, these smaller storm clusters merged as they entered Dawson and Buffalo Counties, quickly evolving into a forward-propagating mesoscale convective system (MCS) with damaging outflow winds. As storms first entered South Central Nebraska, the mesoscale environment featured 3000-4500 J/kg most-unstable CAPE, and around 30 knots of deep-layer vertical shear. Over the course of around 3 hours, wind damage was widespread near the Interstate 80 corridor, but especially within Buffalo County, where gusts estimated as high as 90 MPH resulted in numerous damage reports. To name just a few, these reports included a roof torn from a home, numerous grain bins damaged or destroyed, and a number of power poles snapped, causing power outages in the area.  Nebraska Public Power District estimated 32 miles of power lines and 218 individual power structures were blown down in the Buffalo County area. Multiple reports were also received of damage to area trees and crops. Farther east, winds were not quite as strong, but still maintained severe levels as gusts to 68 MPH were measured at the Hastings airport, and 61 MPH at the Aurora airport. In addition to severe winds, there were also a few reports of hail during the evening, with the largest being golf ball size north of Lexington.",40.6,-98.43
252212,7/22/2010 23:13,59,MG,nan,"A stalled frontal boundary combined with a moist and unstable atmosphere and strong wind shear to produce numerous tornadoes and funnel clouds over South Central and Southeast Wisconsin. A series of vorticity maxima moving west to east through the western Great Lakes enhanced isentropic lift, as a strengthening southerly low-level jet interacted with a nearly stationary west to east warm front.",43.049,-88.22
241399,8/10/2010 23:51,59,MG,A trained spotter measured a 59 knot wind gust at the intersection of Highway 8 and 14.,"Several rounds of heavy rainfall led to signficant flash flooding in portions of east-central Minnesota, and west-central Wisconsin.  Several areas in the Twin Cities had signficant street flooding with isolated rainfall amounts of 2 to 5 inches occurring around the City of Minneapolis where several police cars and buses stalled in the flood waters.  Prior to the flooding, lines of strong to severe thunderstorms moved across southern and portions of east central Minnesota, where localized wind damage occurred.",45.3915,-92.8571
259119,8/13/2010 0:39,59,MG,nan,Thunderstorms developed along a southeast moving surface trough and a few became severe.,38.09,-100.86
240858,8/13/2010 2:36,59,MG,A second round of strong winds occurred in south Fargo.,"A strong low level jet and good warm advection helped to spawn a couple strong thunderstorms in the early morning hours of the 12th. Then there was a brief break before strong thunderstorms began to flare up again by the early afternoon. Thunderstorms kept firing north of a warm front located over northeast South Dakota and southern Minnesota, as the low level jet and warm advection stay strong through the day. These storms produced very heavy rainfall rates and some flash flooding as well as sporadic reports of strong winds into the evening.",46.88,-96.82
249176,8/16/2010 19:30,59,MG,Severe criteria wind gusts were observed at the ONeill airport from a fast moving supercell thunderstorm.,"An upper level disturbance helped spark scattered thunderstorms, some of which were severe, across Nebraska during the late morning and afternoon hours on August 16th.",42.46,-98.69
259178,8/24/2010 1:03,59,MG,nan,Very severe wind gusts were reported with some of the severe thunderstorms that occurred during the evening.  Heavy rainfall also accumulated during the evening and overnight.,38.83,-99.32
259997,9/1/2010 17:24,59,MG,The automated weather station at North Texas Regional Airport/Perrin Field (KGYI) measured a wind gust of 68 mph.,"Embedded shortwaves moving through a broad trough over the Southern Plains sparked several showers and thunderstorms across north Texas. Some of the storms developed on outflow boundaries from convection during the day. A few reports of severe thunderstorm wind damage and hail was reported, but several lightning strikes started fires. The most significant wind damage occurred in Reagor Springs in Ellis County from a possible microburst.",33.72,-96.67
260188,9/16/2010 2:32,59,MG,A storm spotter measured a winds gust using a hand held anemometer. No damage was reported in the grass and farm dominated location.,Thunderstorms moved through southeast Kansas producing flooding across the region. Additional strong to severe thunderstorms produced wind damage from near Pittsburg to Baxter Springs during the evening hours as the storms moved into Missouri.,37.46,-94.69
263201,10/26/2010 7:48,59,MG,A 59 knot or 68 mph wind gust was measured at KVIH.,A thin line of strong to severe thunderstorms impacted the Missouri Ozarks during the evening of October 25th. Several reports of wind damage were received as these storms raced east at nearly 50 mph. These storms developed along a strong cold front which extended south from a powerful low pressure system centered over the northern plains.,38.1277,-91.7702
262692,10/26/2010 12:46,59,MG,The ASOS at the Kenosha airport recorded a thunderstorm wind gust of 59 knots (68 mph) with sustained winds of 43 knots (49 mph). Trees were reported blown down in the vicinity from the thunderstorm wind gusts.,An intensifying 50 to 70 knot low-level jet ahead of an intense negatively-tilted upper level trough over the Plains transported low-level moisture and instability into southern Wisconsin during the early morning hours of October 26th. Overall forcing for ascent increased as a vorticity maximum rounded the base of the upper trough and lifted northeast across western Wisconsin.  Severe thunderstorms developed ahead of a surface cold/occluded front that trailed from record surface low pressure over northern Minnesota. Strong shear profiles were supportive of rotating updrafts which produced damaging wind gusts and an EF1 tornado that moved from extreme northern Kenosha County into eastern Racine County.  For additional related information go to this URL: http://www.crh.noaa.gov/mkx/?n=102610_recordcyclone.,42.6,-87.93
